steam_appid,type,name,required_age,is_free,header_imagedlc,developers,publishers,detailed_description,about_the_game,short_description,supported_languages,package_prices,categories,genres,movies,achievements_total,achievements_highlight,coming_soon_date,release_date,num_screenshots,final_price,windows,mac,linux,total_rec_counts,pc_req_min,mac_req_min,linux_req_min,pc_req_rec,mac_req_rec,linux_req_rec,regions_description
1086940,game,Baldur's Gate 3,18,False,,['Larian Studios'],['Larian Studios'],"Gather your party and return to the Forgotten Realms in a tale of fellowship and betrayal, sacrifice and survival, and the lure of absolute power.; Mysterious abilities are awakening inside you, drawn from a mind flayer parasite planted in your brain. Resist, and turn darkness against itself. Or embrace corruption, and become ultimate evil.; From the creators of Divinity: Original Sin 2 comes a next - generation RPG, set in the world of Dungeons & Dragons.; ; ; Choose from 12 classes and 11 races from the D&D Player's Handbook and create your own identity, or play as an Origin hero with a hand - crafted background. Or tangle with your inner corruption as the Dark Urge, a fully customisable Origin hero with its own unique mechanics and story. Whoever you choose to be, adventure, loot, battle and romance your way across the Forgotten Realms and beyond. Gather your party. Take the adventure online as a party of up to four.; ; Abducted, infected, lost. You are turning into a monster, but as the corruption inside you grows, so does your power. That power may help you to survive, but there will be a price to pay, and more than any ability, the bonds of trust that you build within your party could be your greatest strength. Caught in a conflict between devils, deities, and sinister otherworldly forces, you will determine the fate of the Forgotten Realms together.; ; ; Forged with the new Divinity 4. 0 engine, Baldur’s Gate 3 gives you unprecedented freedom to explore, experiment, and interact with a thriving world filled with characters, dangers, and deceit. A grand, cinematic narrative brings you closer to your characters than ever before. From shadow - cursed forests, to the magical caverns of the Underdark, to the sprawling city of Baldur’s Gate itself, your actions define the adventure, but your choices define your legacy. You will be remembered.; ; The Forgotten Realms are a vast, detailed, and diverse world, and there are secrets to be discovered all around you - verticality is a vital part of exploration. Sneak, dip, shove, climb, and jump as you journey from the depths of the Underdark to the glittering rooftops of Baldur’s Gate. Every choice you make drives your story forward, each decision leaving your mark on the world. Define your legacy, nurture relationships and create enemies, and solve problems your way. No two playthroughs will ever be the same.; ; allows you to combine your forces in combat and simultaneously attack enemies, or split your party to each follow your own quests and agendas. Concoct the perfect plan together… or introduce an element of chaos when your friends least expect it. Relationships are complicated. Especially when you’ve got a parasite in your brain.; 7 unique Origin heroes offer a hand - crafted experience, each with their own unique traits, agenda, and outlook on the world. Their stories intersect with the overarching narrative, and your choices will determine whether those stories end in redemption, salvation, domination, or one of many other outcomes. Play as an Origin and enjoy their stories, or recruit them to fight alongside you.; based on the D&D 5e ruleset. Team - based initiative, advantage and disadvantage, and roll modifiers join an advanced AI, expanded environmental interactions, and a new fluidity in combat that rewards strategy and foresight. Three difficulty settings allow you to customise the challenge of combat. Enable weighted dice to help sway the battle, or play on Tactician mode for a hardcore experience.; featuring 31 subraces on top of the 11 races (Human, Githyanki, Half - Orc, Dwarf, Elf, Drow, Tiefling, Halfling, Half Elf, Gnome, Dragonborn), with 46 subclasses branching out of the 12 classes. Over 600 spells and actions offer near - limitless freedom of interactivity in a hand - crafted world where exploration is rewarded, and player agency defines the journey. Our unique Character Creator features unprecedented depth of character, with reactivity that ensures whomever you are, you will leave a unique legacy behind you, all the way up to Level 12. Over 174 hours of cinematics ensure that no matter the choices you make, the cinematic experience follows your journey - every playthrough, a new cinematic journey.; With the looming threat of war heading to Baldur’s Gate, and a mind flayer invasion on the horizon, friendships - though not necessary - are bound to be forged on your journey. What becomes of them is up to you, as you enter real, vibrant relationships with those you meet along the way. Each companion has their own moral compass and will react to the choices you make throughout your journey. At what cost will you stick to your ideals? Will you allow love to shape your actions? The relationships made on the road to Baldur’s Gate act as moments of respite at camp as much as they add weight to the many decisions you make on your adventure.; so that when you hit ‘go live’, your stream isn’t interrupted by a bear, swear, or lack of underwear. Baldur’s Gate 3 has 3 different levels of streamer - friendly customisation. You can disable nudity and explicit content separately (or together), and you can enable Twitch integration to interact directly with your audience, just as we do at our Panel From Hell showcases! You’ll be able to stream Baldur’s Gate 3 without any problems, regardless of how you play, thanks to these options.","Gather your party and return to the Forgotten Realms in a tale of fellowship and betrayal, sacrifice and survival, and the lure of absolute power.; Mysterious abilities are awakening inside you, drawn from a mind flayer parasite planted in your brain. Resist, and turn darkness against itself. Or embrace corruption, and become ultimate evil.; From the creators of Divinity: Original Sin 2 comes a next - generation RPG, set in the world of Dungeons & Dragons.; ; ; Choose from 12 classes and 11 races from the D&D Player's Handbook and create your own identity, or play as an Origin hero with a hand - crafted background. Or tangle with your inner corruption as the Dark Urge, a fully customisable Origin hero with its own unique mechanics and story. Whoever you choose to be, adventure, loot, battle and romance your way across the Forgotten Realms and beyond. Gather your party. Take the adventure online as a party of up to four.; ; Abducted, infected, lost. You are turning into a monster, but as the corruption inside you grows, so does your power. That power may help you to survive, but there will be a price to pay, and more than any ability, the bonds of trust that you build within your party could be your greatest strength. Caught in a conflict between devils, deities, and sinister otherworldly forces, you will determine the fate of the Forgotten Realms together.; ; ; Forged with the new Divinity 4. 0 engine, Baldur’s Gate 3 gives you unprecedented freedom to explore, experiment, and interact with a thriving world filled with characters, dangers, and deceit. A grand, cinematic narrative brings you closer to your characters than ever before. From shadow - cursed forests, to the magical caverns of the Underdark, to the sprawling city of Baldur’s Gate itself, your actions define the adventure, but your choices define your legacy. You will be remembered.; ; The Forgotten Realms are a vast, detailed, and diverse world, and there are secrets to be discovered all around you - verticality is a vital part of exploration. Sneak, dip, shove, climb, and jump as you journey from the depths of the Underdark to the glittering rooftops of Baldur’s Gate. Every choice you make drives your story forward, each decision leaving your mark on the world. Define your legacy, nurture relationships and create enemies, and solve problems your way. No two playthroughs will ever be the same.; ; allows you to combine your forces in combat and simultaneously attack enemies, or split your party to each follow your own quests and agendas. Concoct the perfect plan together… or introduce an element of chaos when your friends least expect it. Relationships are complicated. Especially when you’ve got a parasite in your brain.; 7 unique Origin heroes offer a hand - crafted experience, each with their own unique traits, agenda, and outlook on the world. Their stories intersect with the overarching narrative, and your choices will determine whether those stories end in redemption, salvation, domination, or one of many other outcomes. Play as an Origin and enjoy their stories, or recruit them to fight alongside you.; based on the D&D 5e ruleset. Team - based initiative, advantage and disadvantage, and roll modifiers join an advanced AI, expanded environmental interactions, and a new fluidity in combat that rewards strategy and foresight. Three difficulty settings allow you to customise the challenge of combat. Enable weighted dice to help sway the battle, or play on Tactician mode for a hardcore experience.; featuring 31 subraces on top of the 11 races (Human, Githyanki, Half - Orc, Dwarf, Elf, Drow, Tiefling, Halfling, Half Elf, Gnome, Dragonborn), with 46 subclasses branching out of the 12 classes. Over 600 spells and actions offer near - limitless freedom of interactivity in a hand - crafted world where exploration is rewarded, and player agency defines the journey. Our unique Character Creator features unprecedented depth of character, with reactivity that ensures whomever you are, you will leave a unique legacy behind you, all the way up to Level 12. Over 174 hours of cinematics ensure that no matter the choices you make, the cinematic experience follows your journey - every playthrough, a new cinematic journey.; With the looming threat of war heading to Baldur’s Gate, and a mind flayer invasion on the horizon, friendships - though not necessary - are bound to be forged on your journey. What becomes of them is up to you, as you enter real, vibrant relationships with those you meet along the way. Each companion has their own moral compass and will react to the choices you make throughout your journey. At what cost will you stick to your ideals? Will you allow love to shape your actions? The relationships made on the road to Baldur’s Gate act as moments of respite at camp as much as they add weight to the many decisions you make on your adventure.; so that when you hit ‘go live’, your stream isn’t interrupted by a bear, swear, or lack of underwear. Baldur’s Gate 3 has 3 different levels of streamer - friendly customisation. You can disable nudity and explicit content separately (or together), and you can enable Twitch integration to interact directly with your audience, just as we do at our Panel From Hell showcases! You’ll be able to stream Baldur’s Gate 3 without any problems, regardless of how you play, thanks to these options.","Baldur’s Gate 3 is a story - rich, party - based RPG set in the universe of Dungeons & Dragons, where your choices shape a tale of fellowship and betrayal, survival and sacrifice, and the lure of absolute power.","English , French, German, Spanish - Spain, Polish, Russian, Simplified Chinese, Turkish, Portuguese - Brazil, Italian, Spanish - Latin America, Traditional Chinese, Ukrainian, Korean, Japanese; languages with full audio support",[99000000],"['Single-player', 'Multi-player', 'Co-op', 'Online Co-op', 'LAN Co-op', 'Cross-Platform Multiplayer', 'Steam Achievements', 'Full controller support', 'Steam Trading Cards', 'Adjustable Text Size', 'Camera Comfort', 'Color Alternatives', 'Custom Volume Controls', 'Adjustable Difficulty', 'Playable without Timed Input', 'Save Anytime', 'Stereo Sound', 'Subtitle Options', 'Surround Sound', 'Steam Cloud', 'Remote Play on TV', 'Remote Play Together', 'Family Sharing']","['Adventure', 'RPG', 'Strategy']","[""Baldur's Gate 3 - Accolades Trailer"", ""Baldur's Gate 3 - Launch Trailer"", ""Baldur's Gate 3 - Release Teaser"", ""Baldur's Gate 3 - First Look at the City"", ""Baldur's Gate 3 - Release Date Reveal Trailer"", ""Baldur's Gate 3 - The Game Awards Trailer""]",54,"['Descent From Avernus', 'The Plot Thickens', 'The City Awaits', ""All's Well That Ends Well"", 'Absolute Power Corrupts', 'Hero of the Forgotten Realms', 'Sins of the Father', 'Ceremorphosis', 'Roleplayer', 'Bedrolls and Breakfast']",False,2023-08-03,19,990.000₫,True,True,False,695940,Minimum:; Requires a 64 - bit processor and operating system; OS: Windows 10 64 - bit; Processor: Intel I5 4690 / AMD FX 8350 / Snapdragon X Elite; Memory: 8 GB RAM; Graphics: Nvidia GTX 970 / RX 480 / Intel Arc A380 / Qualcomm Adreno X1 (4GB+ of VRAM); DirectX: Version 11; Storage: 150 GB available space; Additional Notes: SSD required,Minimum:; OS: macOS 14. 7. 1 or newer; Processor: Apple M1; Memory: 8 GB RAM; Graphics: Apple M1; Storage: 150 GB available space; Additional Notes: Min specs can run the game on low to medium settings. Splitscreen will not run at an acceptable level of performance. SSD required.,Minimum:,Recommended:; Requires a 64 - bit processor and operating system; OS: Windows 10 64 - bit; Processor: Intel i7 8700K / AMD r5 3600; Memory: 16 GB RAM; Graphics: Nvidia 2060 Super / RX 5700 XT / Intel Arc A580 (8GB+ of VRAM); DirectX: Version 11; Storage: 150 GB available space; Additional Notes: SSD required,Recommended:; OS: Latest macOS; Processor: Apple M1 Pro or better; Memory: 16 GB RAM; Graphics: Apple M1 Pro or better; Storage: 150 GB available space; Additional Notes: Recommended specs can run the game on high or ultra settings. SSD required.,Recommended:,"esrb: (required_age=17, descriptors=Intense Violence Blood and Gore Strong Sexual Content Nudity Strong Language) | pegi: (required_age=18, descriptors=Violence Bad Language Sex) | dejus: (required_age=16, descriptors=Violência Extrema Linguagem imprópria Nudez) | csrr: (required_age=18, descriptors=性, 暴力, 不當言語) | usk: (required_age=18, descriptors=Drastische Gewalt Horror Sexuelle Inhalte) | steam_germany: (required_age=18, descriptors=Gewalt)"
3405690,game,EA SPORTS FC™ 26,0,False,,"['EA Canada', 'EA Romania']",['Electronic Arts'],"Take your FC loyalty to the next level Play EA SPORTS FC 25 and EA SPORTS FC 26 before 1 November 2025 to become an EA SPORTS FC 26 Club Member and receive exclusive benefits in EA SPORTS FC 26‡.; EA SPORTS FC 26 Ultimate Edition; EA SPORTS FC 26 Ultimate Edition includes‡:; 6000 FC Points over 2 months††; 1 additional Ultimate Team Player Evolution Slot; Clubs rewards:; 1 Archetype Unlock Consumable; 2 Double AXP for 10 Matches Consumables; Career rewards:; 3 ICON Career Players; 5 - Star Coach available for hire in Manager Career; 5 - Star Youth Scout available for hire in Manager Career; Manager Live Challenge Content; About the Game; This game includes optional in - game purchases of virtual currency that can be used to acquire virtual in - game items, including a random selection of virtual in - game items.","This game includes optional in - game purchases of virtual currency that can be used to acquire virtual in - game items, including a random selection of virtual in - game items.","The Club is Yours in EA SPORTS FC 26. Play your way with an overhauled gameplay experience powered by community feedback, Manager Live Challenges that bring fresh storylines to the new season, and Archetypes inspired by greats of the game.","English , French , Italian , German , Spanish - Spain , Arabic , Dutch , Japanese , Korean , Polish , Portuguese - Brazil , Simplified Chinese , Spanish - Latin America , Turkish , Czech, Danish, Norwegian, Portuguese - Portugal, Russian, Swedish, Traditional Chinese; languages with full audio support","[129900000, 179900000, 2500000, 12000000, 23000000, 35000000, 58000000, 116000000, 235000000, 355000000]","['Single-player', 'Multi-player', 'PvP', 'Online PvP', 'Shared/Split Screen PvP', 'Co-op', 'Online Co-op', 'Shared/Split Screen Co-op', 'Shared/Split Screen', 'Cross-Platform Multiplayer', 'Steam Achievements', 'Full controller support', 'In-App Purchases', 'Chat Speech-to-text', 'Adjustable Difficulty', 'Keyboard Only Option', 'Stereo Sound', 'Subtitle Options', 'HDR available']","['Simulation', 'Sports']","['EA SPORTS FC™ 26 | Official Reveal Trailer', 'EA SPORTS FC 26 Official Launch Trailer | The Club is Yours']",43,"['Masterplan', 'Treble Glory', 'Challenge Accepted', 'Expect the Unexpected', 'Legend on the Pitch', 'European Glory', 'Tactical Sync', 'Campeones', ""We're Going Up"", 'Top of the Pyramid']",False,2025-09-25,9,,True,False,False,12166,Minimum:; Requires a 64 - bit processor and operating system; OS: Windows 10/11 - 64 - Bit (Latest Update).; Processor: AMD Ryzen 5 1600 or Intel Core i5 6600k; Memory: 8 GB RAM; Graphics: AMD RX 570 or Nvidia GTX 1050 Ti; DirectX: Version 12; Network: Broadband Internet connection; Storage: 100 GB available space; Sound Card: DirectX: 12 Compatible video card or equivalent (feature level 12_0),Minimum:,Minimum:,Recommended:; Requires a 64 - bit processor and operating system; OS: Windows 10/11 - 64 - Bit (Latest Update).; Processor: AMD Ryzen 7 2700X or Intel Core i7 6700; Memory: 12 GB RAM; Graphics: AMD RX 5600 XT or Nvidia GTX 1660; DirectX: Version 12; Network: Broadband Internet connection; Storage: 100 GB available space; Sound Card: DirectX: 12 Compatible video card or equivalent (feature level 12_0),Recommended:,Recommended:,"esrb: (required_age=6, descriptors=) | pegi: (required_age=3, descriptors=In - Game Purchases) | usk: (required_age=12, descriptors=Erhöhte Kaufanreize Druck zum Vielspielen) | fpb: (required_age=10, descriptors=CI (Competitive Intensity)) | csrr: (required_age=0, descriptors=) | oflc: (required_age=15, descriptors=Chance - based In - game purchases Online interactivity and chat) | dejus: (required_age=0, descriptors=) | kgrb: (required_age=0, descriptors=) | nzoflc: (required_age=15, descriptors=Chance - based In - game purchases Online interactivity and chat) | steam_germany: (required_age=0, descriptors=)"
2767030,game,Marvel Rivals,0,True,,['NetEase Games'],['NetEase Games'],"Marvel Rivals Season 4. 5: Update Overview; About the Game Marvel Rivals is a Super Hero Team - Based PVP Shooter! Assemble an all - star Marvel squad, devise countless strategies by combining powers to form unique Team - Up skills and fight in destructible, ever - changing battlefields across the continually evolving Marvel universe! A Deep and Varied Marvel Roster Choose from a vast array of fan - favorite and cult - classic Marvel Super Heroes and Super Villains from across the Avengers, Guardians of the Galaxy, X - Men, and many more from across the Marvel Multiverse. Fast and Fun 6v6 Action with Ever - Changing Game Dynamics With intricate environments, fast - paced gameplay, and ever - changing battlefields, there's never a dull moment in Marvel Rivals! Battle as Super Heroes and Super Villains with incredible abilities and combine your powers to bring unexpected fun to the battlefield in a matter of seconds. Dynamic Hero Synergy Coordinate unique combinations between characters to ignite surprising Team - Up Skills! Unleash the synergy of combined superpowers and invent new tactics that can turn the tide of combat. Ride on Groot's back as Rocket Raccoon to take on your enemies as a dangerous duo, unleash Gamma energy as Hulk to charge Iron Man's armor for massive damage, and so much more! Creative Environment Destruction Tear your way through iconic Marvel worlds across destructible environments! From Asgard to the Tokyo of 2099, use superpowers to alter these environments, reshape the terrain, and craft a strategic advantage on the battlefield! Take cover to dodge attacks or use makeshift weapons to strike down enemies. Players will find countless ways to utilize the environment to claim victory! Continually Evolving Universe and Robust Post - Launch Updates The Marvel Multiverse brings infinite possibilities! Each seasonal drop will introduce new Super Heroes to the battlefield along with challenging and diverse maps! Unlock new content to implement across various gameplay strategies while experiencing thrilling action and endless possibilities in these adventurous team battles!","Marvel Rivals is a Super Hero Team - Based PVP Shooter! Assemble an all - star Marvel squad, devise countless strategies by combining powers to form unique Team - Up skills and fight in destructible, ever - changing battlefields across the continually evolving Marvel universe! A Deep and Varied Marvel Roster Choose from a vast array of fan - favorite and cult - classic Marvel Super Heroes and Super Villains from across the Avengers, Guardians of the Galaxy, X - Men, and many more from across the Marvel Multiverse. Fast and Fun 6v6 Action with Ever - Changing Game Dynamics With intricate environments, fast - paced gameplay, and ever - changing battlefields, there's never a dull moment in Marvel Rivals! Battle as Super Heroes and Super Villains with incredible abilities and combine your powers to bring unexpected fun to the battlefield in a matter of seconds. Dynamic Hero Synergy Coordinate unique combinations between characters to ignite surprising Team - Up Skills! Unleash the synergy of combined superpowers and invent new tactics that can turn the tide of combat. Ride on Groot's back as Rocket Raccoon to take on your enemies as a dangerous duo, unleash Gamma energy as Hulk to charge Iron Man's armor for massive damage, and so much more! Creative Environment Destruction Tear your way through iconic Marvel worlds across destructible environments! From Asgard to the Tokyo of 2099, use superpowers to alter these environments, reshape the terrain, and craft a strategic advantage on the battlefield! Take cover to dodge attacks or use makeshift weapons to strike down enemies. Players will find countless ways to utilize the environment to claim victory! Continually Evolving Universe and Robust Post - Launch Updates The Marvel Multiverse brings infinite possibilities! Each seasonal drop will introduce new Super Heroes to the battlefield along with challenging and diverse maps! Unlock new content to implement across various gameplay strategies while experiencing thrilling action and endless possibilities in these adventurous team battles!","Marvel Rivals is a Super Hero Team - Based PVP Shooter! Assemble an all - star Marvel squad, devise countless strategies by combining powers to form unique Team - Up skills and fight in destructible, ever - changing battlefields across the continually evolving Marvel universe!","English , French, Italian, German, Spanish - Spain, Russian, Turkish, Thai, Simplified Chinese , Traditional Chinese, Spanish - Latin America, Korean, Japanese , Polish, Portuguese - Brazil, Arabic; languages with full audio support",[],"['Multi-player', 'PvP', 'Online PvP', 'Co-op', 'Online Co-op', 'Cross-Platform Multiplayer', 'Steam Achievements', 'Full controller support', 'In-App Purchases']","['Action', 'Free To Play']","['Marvel Rivals Season 4.5 | Daredevil has officially joined', 'Marvel Rivals Season 4: Heart of the Dragon', 'Season 3.5 Is Live Now. Blade Has Joined Marvel Rivals！', 'Marvel Rivals S2.5:Ultron has officially joined Marvel Rivals', 'Season 1.5-Human Torch and The thing join Marvel Rivals', ""Marvel Rivals | Rivals 'Til the End |  Official Launch Trailer"", ""Season 0: Dooms' Rise Official Trailer"", 'No One Rivals Doom | Cinematic Trailer | Marvel Rivals']",49,"['Thumbs\xa0Up', 'Vicious\xa0Vines', 'You\xa0Do\xa0You', 'Rising\xa0Star', 'Onslaught!', 'Smoke\xa0Screen', ""Go\xa0Get\xa0'Em,\xa0Guardians!\xa0"", 'Family\xa0Ties', 'Inevitable！', 'Assemble!']",False,2024-12-05,29,,True,False,False,0,Minimum:; OS: Windows 10 64 - bit (1909 or newer); Processor: Intel Core i5 - 6600K or AMD Ryzen 5 1600X; Memory: 16 GB RAM; Graphics: NVIDIA GeForce GTX 1060 / AMD RX 580 / Intel Arc A380; DirectX: Version 12; Network: Broadband Internet connection; Storage: 70 GB available space; Additional Notes: We recommend you install the game on SSD drive for better experience.,,,Recommended:; OS: Windows 10 64 - bit (1909 or newer); Processor: Intel Core i5 - 10400 or AMD Ryzen 5 5600X; Memory: 16 GB RAM; Graphics: NVIDIA GeForce RTX 2060 (Super) / AMD RX 5700 - XT / Intel Arc A750; DirectX: Version 12; Network: Broadband Internet connection; Storage: 70 GB available space; Additional Notes: We recommend you install the game on SSD drive for better experience.,,,"kgrb: (required_age=15, descriptors=폭력성, 공포) | csrr: (required_age=12, descriptors=暴力, 不當言語) | dejus: (required_age=10, descriptors=Violência) | steam_germany: (required_age=12, descriptors=Gewalt)"
