steam_appid,type,name,required_age,is_free,header_imagedlc,developers,publishers,detailed_description,about_the_game,short_description,supported_languages,package_prices,categories,genres,movies,achievements_total,achievements_highlight,coming_soon_date,release_date,num_screenshots,final_price,windows,mac,linux,total_rec_counts,pc_req_min,mac_req_min,linux_req_min,pc_req_rec,mac_req_rec,linux_req_rec,regions_description
3037410,game,Fish Idle 2: Underwater Mystery,0,True,,['Multicast'],['MulticastGames'],"Crush in your rainboots and hop into your boat! We are going fishing in Fish Idle 2: Underwater Mystery, a unique idle fishing arcade featuring smooth graphics and intuitive mechanics. We have no time to swing a fishing rod, so let’s streamline the process! SIMPLE AND EASY FISHING; Let’s start with the basics. It’s all about automation: fish start biting as soon as you approach them, and resource indicators keep you informed while you focus on managing your Fish Kingdom effectively. The game offers advantageous upgrades to enhance your idle fishing abilities, helping you become a true fish tycoon. You’ll still need to steer your boat to chase fish schools and avoid obstacles, so don’t get too distracted by your economic prowess! UPGRADE YOUR FISH KINGDOM; Once your hull is full, it’s time to get upgraded! Improvements in fishing speed let you catch more and rarer species, while increased storage capacity allows you to hold more catches in your boat. Boost your boat’s speed and defense for impact protection, and enhance your fishing rods to cast multiple lines at once. It’s all about maximizing your gains in the most efficient way, so you’ll have to use your head to figure out the best way to success! MAKE IT BIG; Just like in real life, becoming a fish tycoon involves various ways to profit from your catches. The Idle Fish Farm allows you to invest and get passive income, while the Black Market lets you upgrade your Fish Kingdoms beyond OSHA standards. The Bots Shop enables you to hire hunter, fisher, and cargo ships to fish and deliver catch for you, boosting your income. If day trading is your thing, there is a Currency Exchange that has some special benefits. Tax fraud is not a crime, it’s an obligation if you want to make it big. NOW GO FISH; Get ready to dive into the Fish Kingdoms and become the ultimate fish tycoon in Fish Idle 2: Underwater Mystery!","Crush in your rainboots and hop into your boat! We are going fishing in Fish Idle 2: Underwater Mystery, a unique idle fishing arcade featuring smooth graphics and intuitive mechanics. We have no time to swing a fishing rod, so let’s streamline the process! SIMPLE AND EASY FISHING; Let’s start with the basics. It’s all about automation: fish start biting as soon as you approach them, and resource indicators keep you informed while you focus on managing your Fish Kingdom effectively. The game offers advantageous upgrades to enhance your idle fishing abilities, helping you become a true fish tycoon. You’ll still need to steer your boat to chase fish schools and avoid obstacles, so don’t get too distracted by your economic prowess! UPGRADE YOUR FISH KINGDOM; Once your hull is full, it’s time to get upgraded! Improvements in fishing speed let you catch more and rarer species, while increased storage capacity allows you to hold more catches in your boat. Boost your boat’s speed and defense for impact protection, and enhance your fishing rods to cast multiple lines at once. It’s all about maximizing your gains in the most efficient way, so you’ll have to use your head to figure out the best way to success! MAKE IT BIG; Just like in real life, becoming a fish tycoon involves various ways to profit from your catches. The Idle Fish Farm allows you to invest and get passive income, while the Black Market lets you upgrade your Fish Kingdoms beyond OSHA standards. The Bots Shop enables you to hire hunter, fisher, and cargo ships to fish and deliver catch for you, boosting your income. If day trading is your thing, there is a Currency Exchange that has some special benefits. Tax fraud is not a crime, it’s an obligation if you want to make it big. NOW GO FISH; Get ready to dive into the Fish Kingdoms and become the ultimate fish tycoon in Fish Idle 2: Underwater Mystery!","Dive into the most fun idle fishing arcade game! Manage your Fish Kingdoms with automated fishing, upgrade your boat and gear, invest in passive income, and outsmart the market. Become the ultimate fish tycoon!","English, Spanish - Spain, German, Korean, Russian, Japanese",[],['Single-player'],"['Adventure', 'Casual', 'Indie', 'Free To Play']",['Underwater mystery'],30,"['First Catch!', 'Casting Beginner', 'Smooth Sailor', 'Seasoned Angler', 'Master Fisherman', ' Ocean Explorer ', 'Legend of the Seas', 'Sailor’s Start', 'Calm Waters ', 'Storm Chaser ']",False,2024-11-15,6,,True,False,False,682,Minimum:; OS: windows 10; Processor: Core I3; Graphics: no; Sound Card: -; VR Support: no,,,Recommended:; OS: windows 10; Processor: Core I3; Graphics: no; Sound Card: -; VR Support: no,,,"dejus: (required_age=0, descriptors=) | steam_germany: (required_age=0, descriptors=)"
4000,game,Garry's Mod,0,False,,['Facepunch Studios'],['Valve'],"Garry's Mod is a physics sandbox. There aren't any predefined aims or goals. We give you the tools and leave you to play.; You spawn objects and weld them together to create your own contraptions - whether that's a car, a rocket, a catapult or something that doesn't have a name yet - that's up to you. You can do it offline, or join the thousands of players who play online each day.; If you're not too great at construction - don't worry! You can place a variety of characters in silly positions. But if you want to do more, we have the means. Beyond the Sandbox; The Garry's Mod community is a tremendous source of content and has added hundreds of unique modes to the game. In Trouble In Terrorist Town, you can be a detective solving an online murder as criminals attempt to cover up their homicides. Be a ball, a plant, a chair, or anything else in Prop Hunt's elaborate, shape - shifting game of Hide & Seek. Elevator: Source is gaming's first elevator thrill ride, delivering players to airlocks and kitten dance parties.; We have one of the most vibrant Steam Community Workshops, with over 300'000 models, maps, and contraptions to download. It has everything from new tools to improve your builds, to guns that fire rainbow - tinged nuclear blasts from space. Take as much or as little as you need: it’s all free.; Please note: Some multiplayer servers and game - modes might require you to own other games - such as Counter - Strike: Source and Team Fortress 2.","Garry's Mod is a physics sandbox. There aren't any predefined aims or goals. We give you the tools and leave you to play.; You spawn objects and weld them together to create your own contraptions - whether that's a car, a rocket, a catapult or something that doesn't have a name yet - that's up to you. You can do it offline, or join the thousands of players who play online each day.; If you're not too great at construction - don't worry! You can place a variety of characters in silly positions. But if you want to do more, we have the means. Beyond the Sandbox; The Garry's Mod community is a tremendous source of content and has added hundreds of unique modes to the game. In Trouble In Terrorist Town, you can be a detective solving an online murder as criminals attempt to cover up their homicides. Be a ball, a plant, a chair, or anything else in Prop Hunt's elaborate, shape - shifting game of Hide & Seek. Elevator: Source is gaming's first elevator thrill ride, delivering players to airlocks and kitten dance parties.; We have one of the most vibrant Steam Community Workshops, with over 300'000 models, maps, and contraptions to download. It has everything from new tools to improve your builds, to guns that fire rainbow - tinged nuclear blasts from space. Take as much or as little as you need: it’s all free.; Please note: Some multiplayer servers and game - modes might require you to own other games - such as Counter - Strike: Source and Team Fortress 2.",Garry's Mod is a physics sandbox. There aren't any predefined aims or goals. We give you the tools and leave you to play.,"English , French, Italian, German, Spanish - Spain, Bulgarian, Czech, Danish, Dutch, Finnish, Greek, Hungarian, Japanese, Korean, Norwegian, Polish, Portuguese - Portugal, Portuguese - Brazil, Russian, Simplified Chinese, Swedish, Thai, Traditional Chinese, Turkish, Ukrainian, Vietnamese, Croatian, Estonian, Hebrew, Lithuanian, Slovak; languages with full audio support","[6000000, 12000000]","['Single-player', 'Multi-player', 'PvP', 'Online PvP', 'LAN PvP', 'Co-op', 'Online Co-op', 'LAN Co-op', 'Cross-Platform Multiplayer', 'Steam Achievements', 'Steam Trading Cards', 'Captions available', 'Steam Workshop', 'Steam Cloud', 'Valve Anti-Cheat enabled', 'Includes level editor', 'Includes Source SDK', 'Remote Play on Tablet', 'Family Sharing']","['Casual', 'Indie', 'Simulation']",[],29,"['Play Singleplayer', 'Play Multiplayer', 'Startup Millenium', 'Secret Phrase', 'Addict', 'Map Loader', 'Play Around', 'War Zone', 'Friendly', 'Yes, I am the real garry!']",False,2006-11-29,20,60.000₫,True,True,True,1020856,"Minimum:; OS: Windows 10; Processor: 2 GHz Processor or better; Memory: 4 GB RAM; Graphics: 1GB dedicated VRAM or better; DirectX: Version 9. 0c; Network: Broadband Internet connection; Storage: 10 GB available space; Sound Card: DirectX 9 compatible; Additional Notes: Mouse, Keyboard, Monitor","Minimum:; OS: OS X version Snow Leopard 10. 6. 3; Processor: 2 GHz Processor or better; Memory: 4 GB RAM; Graphics: 1GB dedicated VRAM or better; Network: Broadband Internet connection; Storage: 10 GB available space; Additional Notes: Mouse, Keyboard, Monitor","Minimum:; OS: Ubuntu 12. 04; Processor: 2 GHz Processor or better; Memory: 4 GB RAM; Graphics: 1GB dedicated VRAM or better; Network: Broadband Internet connection; Storage: 10 GB available space; Additional Notes: Mouse, Keyboard, Monitor",Recommended:; OS: Windows 10/11; Processor: 2. 5 GHz Processor or better; Memory: 8 GB RAM; Graphics: 4GB dedicated VRAM or better; DirectX: Version 9. 0c; Network: Broadband Internet connection; Storage: 25 GB available space,Recommended:; OS: Latest OS X version; Processor: 2. 5 GHz Processor or better; Memory: 8 GB RAM; Graphics: 4GB dedicated VRAM or better; Network: Broadband Internet connection; Storage: 25 GB available space,Recommended:; OS: Latest Ubuntu; Processor: 2. 5 GHz Processor or better; Memory: 8 GB RAM; Graphics: 4GB dedicated VRAM or better; Network: Broadband Internet connection; Storage: 25 GB available space,"dejus: (required_age=12, descriptors=Violência) | steam_germany: (required_age=16, descriptors=Gewalt)"
2352620,game,Fellowship,0,False,,['Chief Rebel'],['Arc Games'],"Supporter Edition We appreciate all the support from the Fellowship community! If you'd like to show extra support for Fellowship, you can purchase the Supporter Edition for some exclusive visual variants to let all other Fellows know that you love Fellowship! The Supporter Edition includes Fellowship & all 3 Supporter Packs. These Supporter Packs are for Fellows who believe in what we’re building and want to see the Fellowship grow stronger and face deadlier threats. Your support directly fuels the continued development of the game, future Heroes, more Dungeons, and new updates for all who fight for the Fellowship. In return, you’ll receive the following Supporter Packs: The Guardian’s Supporter Pack Crafted by the realm’s greatest artisans for guardians of legend: Helena, Mara, and Vigour. Three unique armor and weapon cosmetics, one for each associated Hero, and a noble spirit mount that can be ridden by any Hero!; Helena’s Frostsworn Protector Ensemble; Mara’s Timewraith Visage Ensemble; Vigour’s Deepwarden’s Oath Ensemble; Guardian Ghostclaw Mount The Exile’s Supporter Pack Armaments crafted for heroes and villains forged by destiny: Meiko, Ardeos, and Sylvie. Three unique armor and weapon cosmetics, one for each associated Hero, and a ferocious spirit mount that can be ridden by any hero!; Meiko’s Purifier's Raiments Ensemble; Ardeos’s Null Disciple Ensemble; Sylvie’s Everdawn Tangle Ensemble; Vengeful Vermin Mount The Wanderer’s Supporter Pack Mythic equipment befitting heroes who wander the land in search of evil: Elarion, Tariq, and Rime. Three unique armor and weapon cosmetics, one for each associated Hero, and a guiding spirit mount that can be ridden by any Hero!; Elarion’s Drakebound Hunt Ensemble; Tariq’s Abyssal Touch Ensemble; Rime’s Wildspring Oracle Ensemble; Radiant Feline Mount These packs contain purely cosmetic items and unique cosmetic mounts. They are a mark of those who stood with us early, when Fellowship was still being forged. From all of us at the Chief Rebel: Your support means the world and we cannot wait to continue building Fellowship with you!; About the Game FELLOWSHIP is a multiplayer online dungeon adventure set in an exciting fantasy setting, with endlessly scaling dungeon runs. Players must focus on working together as a team, with an emphasis on skill, cooperation, and strategy to defeat bosses, collect loot, and work together to overcome ever - present challenges.; Experience the “Holy Trinity” and build the ultimate team of tanks, healers and damage dealers to take down hordes of enemies and imposing bosses. Work together with your friends to overcome the greatest challenges, creating unbreakable bonds and memorable moments. Players can also flex their individual skills on the competitive leaderboards that show where you stand in Fellowship.; ; Persevere, overcome and ascend through the top ranks in Fellowship! Gather Your Perfect Team Play alongside your friends in teams with 4 Player Co - op Multiplayer in a rich, fantasy world full of challenging enemies and exciting rewards. Swap between a large pool of tank, healer and DPS roles with unique kits to build the perfect balance for your team.; Endless Scaling Replayability Every run will feel like a brand - new challenge with dungeons that will get more difficult as players progress and level up. Players will never out level the game with seasonal updates, dungeon modifiers, new features and rewards that will keep each run fresh and exciting, adding another layer of replayability.; Rewards, Loot, Gear After each completed dungeon run, players will earn loot to make their characters even more powerful! The tougher the dungeon, the better the rewards.; Unique and Complex Boss Mechanics Each boss has unique and varied mechanics, for a fresh experience every run. Enemy skills grow as difficulty increases and additional modifiers continue to challenge players as they grow and improve.","FELLOWSHIP is a multiplayer online dungeon adventure set in an exciting fantasy setting, with endlessly scaling dungeon runs. Players must focus on working together as a team, with an emphasis on skill, cooperation, and strategy to defeat bosses, collect loot, and work together to overcome ever - present challenges.; Experience the “Holy Trinity” and build the ultimate team of tanks, healers and damage dealers to take down hordes of enemies and imposing bosses. Work together with your friends to overcome the greatest challenges, creating unbreakable bonds and memorable moments. Players can also flex their individual skills on the competitive leaderboards that show where you stand in Fellowship.; ; Persevere, overcome and ascend through the top ranks in Fellowship! Gather Your Perfect Team Play alongside your friends in teams with 4 Player Co - op Multiplayer in a rich, fantasy world full of challenging enemies and exciting rewards. Swap between a large pool of tank, healer and DPS roles with unique kits to build the perfect balance for your team.; Endless Scaling Replayability Every run will feel like a brand - new challenge with dungeons that will get more difficult as players progress and level up. Players will never out level the game with seasonal updates, dungeon modifiers, new features and rewards that will keep each run fresh and exciting, adding another layer of replayability.; Rewards, Loot, Gear After each completed dungeon run, players will earn loot to make their characters even more powerful! The tougher the dungeon, the better the rewards.; Unique and Complex Boss Mechanics Each boss has unique and varied mechanics, for a fresh experience every run. Enemy skills grow as difficulty increases and additional modifiers continue to challenge players as they grow and improve.","FELLOWSHIP is a multiplayer online dungeon adventure set in an exciting fantasy setting, with endlessly scaling dungeon runs.","English , French, Italian, German, Spanish - Spain, Russian, Simplified Chinese, Traditional Chinese, Korean, Portuguese - Brazil, Japanese; languages with full audio support","[28900000, 71100000]","['Multi-player', 'Co-op', 'Online Co-op', 'Adjustable Text Size', 'Camera Comfort', 'Custom Volume Controls', 'Adjustable Difficulty', 'Playable without Timed Input', 'Stereo Sound', 'Family Sharing']","['RPG', 'Early Access']","['Fellowship - Early Access Play Now', 'Fellowship - Overview Trailer', 'Fellowship - Announcement Trailer']",0,[],False,2025-10-16,13,289.000₫,True,False,False,3057,Minimum:; Requires a 64 - bit processor and operating system; OS: Windows 10 64 - bit; Processor: Intel Core i3 - 10100 or AMD Ryzen 5 1600; Memory: 16 GB RAM; Graphics: NVIDIA GeForce GTX 1650 or AMD Radeon RX 570; Network: Broadband Internet connection; Storage: 20 GB available space,Minimum:,Minimum:,Recommended:; Requires a 64 - bit processor and operating system; OS: Windows 10 64 - bit; Processor: Intel Core i5 - 11600K or AMD Ryzen 7 3700X; Memory: 16 GB RAM; Graphics: NVIDIA GeForce GTX 2060 or AMD Radeon RX 6600XT; Network: Broadband Internet connection; Storage: 20 GB available space; Additional Notes:,Recommended:,Recommended:,"cadpa: (required_age=16, descriptors=) | dejus: (required_age=0, descriptors=Violência fantasiosa) | steam_germany: (required_age=12, descriptors=Fantasy - Gewalt)"
813780,game,Age of Empires II: Definitive Edition,0,False,,"[""World's Edge"", 'Forgotten Empires', 'CaptureAge', 'Tantalus Media', 'Wicked Witch']",['Xbox Game Studios'],"Age of Empires II: Definitive Edition celebrates the 25th anniversary of one of the most popular strategy games ever, now with stunning 4K Ultra HD graphics, a fully remastered soundtrack, and now includes three expansions with the base game: “Lords of the West, ” “Dynasties of India, ” and “Dawn of the Dukes. ” Frequent updates include events, additional content, new game modes, and enhanced features.; Explore all the original Campaigns and the best - selling expansions like never before. With over 200 hours of gameplay and 1, 000 years of human history, improved experiences await. Head online to challenge other players in your quest for world domination with more than 45 different Civilizations. Recent updates include ongoing support for the Scenario Editor, Quick Play for easy social games, enhancements to the game UI, and more!; Choose your path to greatness with an eye - catching and engaging remaster to one of the most beloved strategy games of all time.","Age of Empires II: Definitive Edition celebrates the 25th anniversary of one of the most popular strategy games ever, now with stunning 4K Ultra HD graphics, a fully remastered soundtrack, and now includes three expansions with the base game: “Lords of the West, ” “Dynasties of India, ” and “Dawn of the Dukes. ” Frequent updates include events, additional content, new game modes, and enhanced features.; Explore all the original Campaigns and the best - selling expansions like never before. With over 200 hours of gameplay and 1, 000 years of human history, improved experiences await. Head online to challenge other players in your quest for world domination with more than 45 different Civilizations. Recent updates include ongoing support for the Scenario Editor, Quick Play for easy social games, enhancements to the game UI, and more!; Choose your path to greatness with an eye - catching and engaging remaster to one of the most beloved strategy games of all time.","42 Civilizations, 229 Campaign Missions, Singleplayer, Co - Op, Multiplayer, In - Game Editor, Mods, Cross - play. . . It is good to be the king.","English , French , Italian , German , Japanese, Korean , Portuguese - Brazil , Russian, Simplified Chinese , Spanish - Latin America , Traditional Chinese , Turkish, Vietnamese, Spanish - Spain , Polish, Hindi, Malay; languages with full audio support",[45000000],"['Single-player', 'Multi-player', 'PvP', 'Online PvP', 'LAN PvP', 'Co-op', 'Online Co-op', 'LAN Co-op', 'Cross-Platform Multiplayer', 'Steam Achievements', 'Steam Trading Cards', 'Steam Cloud', 'Includes level editor', 'Family Sharing']",['Strategy'],"['Definitive Collection', 'Age of Empires II: Definitive Edition']",344,"['Aztec Victory', 'Berber Victory', 'Briton Victory', 'Bulgarian Victory', 'Burmese Victory', 'Byzantine Victory', 'Celtic Victory', 'Chinese Victory', 'Cuman Victory', 'Ethiopian Victory']",False,2019-11-14,12,450.000₫,True,False,False,146668,Minimum:; OS: Windows 10 64bit; Processor: Intel Core 2 Duo or AMD Athlon 64x2 5600+; Memory: 4 GB RAM; Graphics: NVIDIA GeForce GT 420 or ATI Radeon HD 6850 or Intel HD Graphics 4000 or better with 2 GB VRAM; DirectX: Version 11; Network: Broadband Internet connection; Storage: 15 GB available space; Additional Notes: 2GB of video memory + 4GB of system memory required,,,Recommended:; OS: Windows 10 64bit; Processor: 2. 4 Ghz i5 or greater or AMD equivalent; Memory: 8 GB RAM; Graphics: Nvidia GTX 650 or AMD HD 5850 or better; DirectX: Version 11; Network: Broadband Internet connection; Storage: 15 GB available space,,,"esrb: (required_age=13, descriptors=Mild Blood Mild Language Violence) | pegi: (required_age=12, descriptors=Violence Bad Language) | usk: (required_age=12, descriptors=) | oflc: (required_age=10, descriptors=Mild themes, violence and coarse language) | nzoflc: (required_age=10, descriptors=Mild themes, violence and coarse language) | cero: (required_age=12, descriptors=Violence) | kgrb: (required_age=12, descriptors=Violence) | dejus: (required_age=12, descriptors=Violence) | fpb: (required_age=13, descriptors=) | csrr: (required_age=0, descriptors=) | crl: (required_age=12, descriptors=)"
