steam_appid,type,name,required_age,is_free,header_imagedlc,developers,publishers,detailed_description,about_the_game,short_description,supported_languages,package_prices,categories,genres,movies,achievements_total,achievements_highlight,coming_soon_date,release_date,num_screenshots,final_price,windows,mac,linux,total_rec_counts,pc_req_min,mac_req_min,linux_req_min,pc_req_rec,mac_req_rec,linux_req_rec,regions_description
1984270,game,Digimon Story Time Stranger,0,False,,['Media.Vision Inc.'],['Bandai Namco Entertainment Inc.'],"Deluxe Edition; The Deluxe Edition includes:; • Season Pass; - Additional Digimon & Episode Pack 1; - Additional Digimon & Episode Pack 2; - Additional Digimon & Episode Pack 3; - Season Pass Bonus: Farm Item Golden Moai; • Deluxe Edition Bonus: Costume Cyber Sleuth Set; Costumes may not be reflected in some cutscenes.; The DLC included in the Season Pass will be distributed by September 30, 2026.; Ultimate Edition; The Ultimate Edition includes:; • Season Pass; - Additional Digimon & Episode Pack 1; - Additional Digimon & Episode Pack 2; - Additional Digimon & Episode Pack 3; - Season Pass Bonus: Farm Item Golden Moai; • Deluxe Edition Bonus: Costume Cyber Sleuth Set; • Costume Pack; - Costume Swimwear Set; - Costume Chosen Children Set; - Costume Digimon Costume Set; • Costume Public Safety Suit & Special Supplies Set; • Cyber Sleuth BGM Pack; • Early Unlock: Special Agumon & Gabumon; Costumes may not be reflected in some cutscenes.; The DLC included in the Season Pass will be distributed by September 30, 2026.; About the Game Digimon Story Time Stranger is an RPG with monster - taming elements that explores the deep bond between humans and Digimon in an epic story that unravels the mystery of the world’s collapse.; Embark on an adventure that spans across the human world and Digital World, collecting and raising a diverse array of Digimon to fight in turn - based battles.; An Epic Story of Connection; Tokyo, Japan - An agent of a secret organization encounters an unknown creature shortly before a city - leveling explosion. They then reawaken eight years in the past. . .; Take on a mission to uncover the mystery of the world’s collapse, where chance encounters with unique characters will shape your journey across time and parallel worlds - and change fate itself.; ; Adventure Between Worlds and Time; Journey between the parallel human world and the Digital World: Iliad where Digimon reside. See the Digital World and its intricately detailed realms like never before, with interactive elements and special quests to explore.; ; Strategic Turn - Based Battles; Enjoy dynamic turn - based combat that combines strategic elements with evolved battle components. More than 450 Digimon and deep customization options provide limitless ways to approach the challenges of battle and reveal the strength of the bonds formed with your Digimon.","Digimon Story Time Stranger is an RPG with monster - taming elements that explores the deep bond between humans and Digimon in an epic story that unravels the mystery of the world’s collapse.; Embark on an adventure that spans across the human world and Digital World, collecting and raising a diverse array of Digimon to fight in turn - based battles.; An Epic Story of Connection; Tokyo, Japan - An agent of a secret organization encounters an unknown creature shortly before a city - leveling explosion. They then reawaken eight years in the past. . .; Take on a mission to uncover the mystery of the world’s collapse, where chance encounters with unique characters will shape your journey across time and parallel worlds - and change fate itself.; ; Adventure Between Worlds and Time; Journey between the parallel human world and the Digital World: Iliad where Digimon reside. See the Digital World and its intricately detailed realms like never before, with interactive elements and special quests to explore.; ; Strategic Turn - Based Battles; Enjoy dynamic turn - based combat that combines strategic elements with evolved battle components. More than 450 Digimon and deep customization options provide limitless ways to approach the challenges of battle and reveal the strength of the bonds formed with your Digimon.","The latest in the Digimon Story series is finally here! In this RPG, unravel a mystery that spans across the human world and the Digital World, collecting and raising a wide variety of Digimon to save the world.","English , French, Italian, German, Spanish - Spain, Spanish - Latin America, Portuguese - Brazil, Simplified Chinese, Traditional Chinese, Japanese , Korean; languages with full audio support","[6980000, 9980000, 12480000]","['Single-player', 'Steam Achievements', 'Full controller support', 'Steam Cloud', 'Family Sharing']",['RPG'],['RD UPDATED_DSTS_Multi_Release Date Trailer_KR_MULTI_Fullbit_master'],46,"['My Very First Battle', 'The Secrets of Conversion', 'Signs of an Anomaly', 'The Shinjuku Inferno', 'The Time Stranger', 'Welcome to the In-Between Theater', 'Visitor from the Digital World', 'The World Where Digimon Live', ""A Moment's Respite"", 'Power Uninterrupted']",False,2025-10-02,14,"₩ 69,800",True,False,False,7366,"Minimum:; Requires a 64 - bit processor and operating system; OS: Windows 10 / Windows 11; Processor: Intel Core i5 - 8400 /AMD Ryzen5 3600; Memory: 8 GB RAM; Graphics: Nvidia GeForce GTX 970 [4 GB] / AMD Radeon RX 580 [8 GB] /Intel Arc A580 [8 GB]; DirectX: Version 12; Storage: 27 GB available space; Additional Notes: Estimated performance: 1080p/60fps with graphics settings at ""Low"". Framerate might drop in graphics - intensive scenes.",Minimum:,Minimum:,"Recommended:; Requires a 64 - bit processor and operating system; OS: Windows 10 / Windows 11; Processor: Intel Core i7 - 11700K /AMD Ryzen7 3700X; Memory: 16 GB RAM; Graphics: Nvidia GeForce GTX 980 [4 GB] / AMD Radeon RX Vega 56 [8 GB] / Intel Arc A770 [16 GB]; DirectX: Version 12; Storage: 27 GB available space; Additional Notes: Estimated performance: 1080p/60fps with graphics settings at ""High"". Framerate might drop in graphics - intensive scenes. Windows 10 (Version 1809 or later) and a 4GB VRAM GPU (graphics board or video card) are required for DirectX 12 API.",Recommended:,Recommended:,"esrb: (required_age=13, descriptors=Fantasy Violence Suggestive Themes Mild Language Use of Alcohol) | pegi: (required_age=12, descriptors=Bad Language Sex In - Game Purchases) | usk: (required_age=12, descriptors=Düstere Atmosphäre In - Game - Käufe) | oflc: (required_age=15, descriptors=Suicide references and in - game purchases) | nzoflc: (required_age=15, descriptors=Suicide references and in - game purchases) | cero: (required_age=15, descriptors=セクシャル) | kgrb: (required_age=12, descriptors=선정성 폭력성) | dejus: (required_age=12, descriptors=Violência Compras on - line) | fpb: (required_age=13, descriptors=Substance Abuse Violence) | csrr: (required_age=0, descriptors=暴力, 菸酒) | crl: (required_age=12, descriptors=) | gmedia: (required_age=12, descriptors=) | steam_germany: (required_age=16, descriptors=Selbstmord Sexuelle Andeutungen Alkohol / Tabak)"
1938090,game,Call of Duty®,18,False,,"['Treyarch', 'Raven Software', 'Beenox', 'High Moon Studios', 'Activision Shanghai', 'Sledgehammer Games', 'Infinity Ward', 'Demonware', 'Toys for Bob']",['Activision'],"The Call of Duty experience supports Call of Duty: Black Ops 7, Call of Duty: Black Ops 6, and Call of Duty: Warzone. In Call of Duty: Black Ops 7, Treyarch and Raven Software are bringing players the most mind - bending Black Ops ever. Call of Duty: Black Ops 6 is signature Black Ops across a cinematic single - player Campaign, a best - in - class Multiplayer experience and with the epic return of Round - Based Zombies. Call of Duty: Warzone is the massive free - to - play combat arena, featuring Battle Royale and Resurgence. Call of Duty Points (CP) are the in - game currency that can be used in Black Ops 6, Call of Duty: Modern Warfare III, Modern Warfare II, and Warzone to obtain new content. Call of Duty: Black Ops 6, Call of Duty: Modern Warfare III, Call of Duty: Modern Warfare II or Call of Duty: Warzone game required, sold / downloaded separately. CP purchased may also be used to obtain in - game content in certain Call of Duty games with CP functionality enabled. Each game sold separately.","The Call of Duty experience supports Call of Duty: Black Ops 7, Call of Duty: Black Ops 6, and Call of Duty: Warzone. In Call of Duty: Black Ops 7, Treyarch and Raven Software are bringing players the most mind - bending Black Ops ever. Call of Duty: Black Ops 6 is signature Black Ops across a cinematic single - player Campaign, a best - in - class Multiplayer experience and with the epic return of Round - Based Zombies. Call of Duty: Warzone is the massive free - to - play combat arena, featuring Battle Royale and Resurgence. Call of Duty Points (CP) are the in - game currency that can be used in Black Ops 6, Call of Duty: Modern Warfare III, Modern Warfare II, and Warzone to obtain new content. Call of Duty: Black Ops 6, Call of Duty: Modern Warfare III, Call of Duty: Modern Warfare II or Call of Duty: Warzone game required, sold / downloaded separately. CP purchased may also be used to obtain in - game content in certain Call of Duty games with CP functionality enabled. Each game sold separately.","The Call of Duty experience supports Call of Duty: Black Ops 7, Call of Duty: Black Ops 6, and Call of Duty: Warzone.","English , French , Italian , German , Spanish - Spain , Korean , Polish , Russian , Traditional Chinese, Japanese , Spanish - Latin America , Arabic, Simplified Chinese, Portuguese - Brazil , Thai; languages with full audio support","[199900000, 274900000, 168000000, 179900000, 4800000, 12000000, 24000000, 48000000, 96000000, 180000000, 240000000, 179900000]","['Single-player', 'Multi-player', 'PvP', 'Online PvP', 'Co-op', 'Online Co-op', 'Cross-Platform Multiplayer', 'Steam Achievements', 'Full controller support', 'Captions available', 'In-App Purchases']",['Action'],"['BO7 Reveal', 'BO7 Product Offering', 'BO7 Zombies', 'BO7 Multiplayer', 'S6 Launch', 'Accolades', 'PC Trailer']",107,"['A Crappy Way to Die', 'Backpack Guy', 'Crocodile', 'Daredevil', 'Gentleman Thief', 'Ghost-in-Training', 'Must be Wind', 'Nessie', 'Nobody was There', 'Gunless']",False,2022-10-27,10,,True,False,False,396780,"Minimum:; Requires a 64 - bit processor and operating system; OS: Windows 10 64 Bit (latest update); Processor: AMD Ryzen 5 1400 or Intel Core i5 - 6600; Memory: 8 GB RAM; Graphics: AMD Radeon RX 470, NVIDIA GeForce GTX 960 or Intel Arc A580; DirectX: Version 12; Network: Broadband Internet connection; Additional Notes: SSD with 128 GB available space at launch",Minimum:,Minimum:,Recommended:; Requires a 64 - bit processor and operating system; OS: Windows 10 64 Bit (latest update) or Windows 11 64 Bit (latest update); Processor: AMD Ryzen 5 1600X or Intel Core i7 - 6700K; Memory: 12 GB RAM; Graphics: AMD Radeon RX 6600XT or NVIDIA GeForce GTX 1080Ti / RTX 3060; DirectX: Version 12; Network: Broadband Internet connection; Additional Notes: SSD with 128 GB available space at launch,Recommended:,Recommended:,"dejus: (required_age=18, descriptors=) | esrb: (required_age=17, descriptors=Blood and Gore Intense Violence Strong Language Suggestive Themes Use of Drugs) | csrr: (required_age=18, descriptors=) | kgrb: (required_age=19, descriptors=) | pegi: (required_age=18, descriptors=Violence Bad Language In - Game Purchases) | usk: (required_age=18, descriptors=) | fpb: (required_age=18, descriptors=) | oflc: (required_age=15, descriptors=) | nzoflc: (required_age=16, descriptors=Graphic Violence Horror Offensive Language Content that may disturb) | mda: (required_age=18, descriptors=) | steam_germany: (required_age=0, descriptors=)"
552990,game,World of Warships,0,True,,['Wargaming Group Limited'],['Wargaming Group Limited'],"Naval warfare has never looked this good! Download World of Warships for FREE and engage in thrilling battles between massive fleets across a multitude of gigantic maps. Every maneuver, salvo, and push can mean the difference between utmost triumph and total defeat! From the mighty Yamato to the elusive U - 190, explore a near - bottomless sea of playstyles aboard historic battleships, destroyers, cruisers, submarines, and aircraft carriers - each faithfully recreated in 3D. If the life of a lone wolf is not for you, invite your friends to a Division and put your co - operative skills to the test! If you're looking for a real challenge, join a Clan, climb to the top of the Clan league, and strive to be the best on your server! Plot a course across 12 national Tech Trees and fine - tune your personal approach to naval combat by installing modifications, unlocking skills for your Commanders, and augmenting your fleet’s appearance with camouflages and more cosmetics.","Naval warfare has never looked this good! Download World of Warships for FREE and engage in thrilling battles between massive fleets across a multitude of gigantic maps. Every maneuver, salvo, and push can mean the difference between utmost triumph and total defeat! From the mighty Yamato to the elusive U - 190, explore a near - bottomless sea of playstyles aboard historic battleships, destroyers, cruisers, submarines, and aircraft carriers - each faithfully recreated in 3D. If the life of a lone wolf is not for you, invite your friends to a Division and put your co - operative skills to the test! If you're looking for a real challenge, join a Clan, climb to the top of the Clan league, and strive to be the best on your server! Plot a course across 12 national Tech Trees and fine - tune your personal approach to naval combat by installing modifications, unlocking skills for your Commanders, and augmenting your fleet’s appearance with camouflages and more cosmetics.","Immerse yourself in thrilling naval battles and assemble an armada of over 600 ships from the first half of the 20th century - from stealthy destroyers to gigantic battleships. Change the look of your ship, choose upgrades to suit your play style, and go into battle with other players!","English , French , German , Czech, Japanese , Polish , Russian , Thai, Turkish, Spanish - Spain , Korean , Portuguese - Brazil , Traditional Chinese , Italian , Simplified Chinese , Ukrainian, Dutch , Spanish - Latin America; languages with full audio support",[0],"['Multi-player', 'MMO', 'PvP', 'Online PvP', 'Co-op', 'Online Co-op', 'Steam Achievements', 'Steam Trading Cards', 'In-App Purchases', 'Adjustable Text Size', 'Camera Comfort', 'Color Alternatives', 'Custom Volume Controls', 'Playable without Timed Input', 'Steam Cloud']","['Action', 'Massively Multiplayer', 'Simulation', 'Strategy', 'Free To Play']","['WoWS 10th Anniversary Trailer', 'WoWS Gameplay Trailer №2', 'WoWS Gameplay Trailer', 'WoWS Gameplay Trailer №3']",43,"['Battle Hero', 'Legend of the Seas', 'Bane of the Oceans', 'Amateur', 'Warrior', 'Veteran', 'Initial Capital', 'Moneybags', 'Business Magnate', 'Naval Warfare. Arson']",False,2017-11-15,12,,True,False,False,1996,"Minimum:; Requires a 64 - bit processor and operating system; OS : Windows 7 x64; Processor: Intel Core i3 - 3210 3. 2 GHz, AMD Athlon X4 970 Quad Core Processor 3, 8 GHz; Memory: 6 GB RAM; Graphics: 1920×1080; NVIDIA GeForce GTX 770, AMD Radeon RX 570; 2GB VRAM; DirectX: Version 11; Network: Broadband Internet connection; Storage: 61 GB available space; Sound Card: DirectX 11; Additional Notes: Please note, only game accounts created using Steam version of the game are officially supported due to technical reasons.","Minimum:; OS: macOS 10. 7. 5; Processor: Intel Core i5 4570R; Memory: 4 GB RAM; Graphics: 1280×720; Intel HD 5000, Intel Iris 5100; Network: Broadband Internet connection; Storage: 64 GB available space; Additional Notes: Please note, only game accounts created using Steam version of the game are officially supported due to technical reasons.",Minimum:,"Recommended:; Requires a 64 - bit processor and operating system; OS : Windows 7 x64 / 8. 1 / 10 / 11; Processor: Intel Core i5 - 10400 2, 9 GHz, AMD Ryzen 5 3600 3, 6 GHz; Memory: 8 GB RAM; Graphics: 1920×1080; NVIDIA GeForce GTX 770, AMD Radeon RX 570; 4GB VRAM; DirectX: Version 11; Network: Broadband Internet connection; Storage: 63 GB available space; Sound Card: DirectX 11; Additional Notes: Please note, only game accounts created using Steam version of the game are officially supported due to technical reasons.",Recommended:; OS: macOS 10. 10; Processor: Intel Core i5; Memory: 4 GB RAM; Graphics: NVIDIA GeForce GT 750M; Network: Broadband Internet connection; Storage: 65 GB available space; Additional Notes: 1920×1080,Recommended:,"esrb: (required_age=13, descriptors=Violence Suggestive Themes) | kgrb: (required_age=12, descriptors=Sexy/Nudity) | usk: (required_age=12, descriptors=) | dejus: (required_age=10, descriptors=Violência) | pegi: (required_age=12, descriptors=Sex In - Game Purchases (Includes Random Items)) | oflc: (required_age=15, descriptors=Chance - based and in - game purchases, online interactivity and chat) | csrr: (required_age=0, descriptors=Anti - Social Characteristics Sex) | steam_germany: (required_age=12, descriptors=Gewalt)"
1285190,game,Borderlands 4,18,False,,['Gearbox Software'],['2K'],"DELUXE AND SUPER DELUXE EDITIONS; Roadmap; About the Game Borderlands 4 brings intense action, badass Vault Hunters, and billions of wild and deadly weapons to an all - new planet ruled by a ruthless tyrant. Crash into Kairos as one of four new Vault Hunters seeking wealth and glory. Wield powerful Action Skills, customize your build with deep skill trees, and dominate enemies with dynamic movement abilities. Break free from the oppressive Timekeeper, a ruthless dictator who dominates the masses from on high. Now a world - altering catastrophe threatens his perfect Order, unleashing Mayhem across the planet. Become an unstoppable force of battle, blasting through enemies with an all - new arsenal of outrageous weaponry. Move across the Borderlands like never before - double jumping, gliding, dodging, grappling, and more - dealing death from every direction. Explode each encounter with devastating Action Skills that unleash your Vault Hunter's unique abilities. Craft your perfect build with branching skill trees and a deep, rewarding loot chase full of wild weapons and powerful gear. Wreaking havoc across Kairos is awesome alone and even better with friends in 4 - player online co - op. Borderlands 4 is designed for co - op from the ground up; whether you're hunting for loot, tackling missions, or wandering freely, level scaling and individual difficulty keeps the party together and having fun. Freely explore a vast and dangerous world rife with warring factions. Hop on your hover bike and ride through lush fields, towering peaks, and deadly deserts full of fearsome enemies, dynamic events, and engaging quests with unforgettable characters. Unite the people of Kairos and ignite a revolution, tackling this adventure however you see fit in a seamless Borderlands experience. Online play requires Internet connection, and cross - play requires SHiFT Account. Terms apply.","Borderlands 4 brings intense action, badass Vault Hunters, and billions of wild and deadly weapons to an all - new planet ruled by a ruthless tyrant. Crash into Kairos as one of four new Vault Hunters seeking wealth and glory. Wield powerful Action Skills, customize your build with deep skill trees, and dominate enemies with dynamic movement abilities. Break free from the oppressive Timekeeper, a ruthless dictator who dominates the masses from on high. Now a world - altering catastrophe threatens his perfect Order, unleashing Mayhem across the planet. Become an unstoppable force of battle, blasting through enemies with an all - new arsenal of outrageous weaponry. Move across the Borderlands like never before - double jumping, gliding, dodging, grappling, and more - dealing death from every direction. Explode each encounter with devastating Action Skills that unleash your Vault Hunter's unique abilities. Craft your perfect build with branching skill trees and a deep, rewarding loot chase full of wild weapons and powerful gear. Wreaking havoc across Kairos is awesome alone and even better with friends in 4 - player online co - op. Borderlands 4 is designed for co - op from the ground up; whether you're hunting for loot, tackling missions, or wandering freely, level scaling and individual difficulty keeps the party together and having fun. Freely explore a vast and dangerous world rife with warring factions. Hop on your hover bike and ride through lush fields, towering peaks, and deadly deserts full of fearsome enemies, dynamic events, and engaging quests with unforgettable characters. Unite the people of Kairos and ignite a revolution, tackling this adventure however you see fit in a seamless Borderlands experience. Online play requires Internet connection, and cross - play requires SHiFT Account. Terms apply.","Borderlands 4 is a mayhem - fueled looter shooter, jam - packed with billions of weapons, deadly enemies, and intense co - op action. Break free from a dangerous hidden planet as one of four new badass Vault Hunters.","English , French , Italian , German , Spanish - Spain , Japanese , Korean , Portuguese - Brazil, Russian, Simplified Chinese , Thai, Traditional Chinese, Polish, Spanish - Latin America; languages with full audio support","[96800000, 140000000, 181600000]","['Single-player', 'Multi-player', 'Co-op', 'Online Co-op', 'Cross-Platform Multiplayer', 'Steam Achievements', 'Adjustable Text Size', 'Camera Comfort', 'Color Alternatives', 'Custom Volume Controls', 'Adjustable Difficulty', 'Save Anytime', 'Stereo Sound', 'Subtitle Options', 'Surround Sound', 'Partial Controller Support', 'Family Sharing']","['Action', 'Adventure', 'RPG']","['Release Date (Launch) - EN - Unrated', 'Sizzle (Launch) - EN - Unrated', 'Story (Launch) - EN - Unrated']",35,"['Crimson Rising', 'Good Hunter', 'Master of Death and Dance', 'Gear Five!', 'The Lookbook is the Cookbook', 'Catch-A-Ride', 'I Earned This', 'Area of Expertise', 'Brand Equity', 'Ruler of Everything']",False,2025-09-11,17,968.000₫,True,False,False,45417,Minimum:; Requires a 64 - bit processor and operating system; OS: Windows 10 / Windows 11; Processor: Intel Core i7 - 9700 / AMD Ryzen 7 2700X; Memory: 16 GB RAM; Graphics: NVIDIA GeForce RTX 2070 / AMD Radeon RX 5700 XT / Intel Arc A580; Storage: 100 GB available space; Additional Notes: Requires a 64 - bit processor and operating system. Requires 8 CPU Cores for processor. Requires 8 GB VRAM for graphics. SSD storage required,Minimum:,Minimum:,Recommended:; Requires a 64 - bit processor and operating system; OS: Windows 10 / Windows 11; Processor: Intel Core i7 - 12700 / AMD Ryzen 7 5800X; Memory: 32 GB RAM; Graphics: NVIDIA GeForce RTX 3080 / AMD Radeon RX 6800 XT / Intel Arc B580; Storage: 100 GB available space; Additional Notes: Requires a 64 - bit processor and operating system. SSD storage required,Recommended:,Recommended:,"esrb: (required_age=17, descriptors=Blood and Gore Intense Violence Sexual Themes Strong Language) | pegi: (required_age=18, descriptors=Violence) | usk: (required_age=18, descriptors=Drastische Gewalt) | oflc: (required_age=15, descriptors=Science Fiction Violence Strong Themes) | csrr: (required_age=18, descriptors=) | fpb: (required_age=18, descriptors=LPV(PPS)(CI) L = Language P = Prejudice V = Violence PPS = Photo or pattern sensitivity, motion sickness and reactions to low frequency sound CI = Competitive Intensity) | dejus: (required_age=18, descriptors=Drogas Violência extrema) | kgrb: (required_age=19, descriptors=Violence Language) | nzoflc: (required_age=16, descriptors=Violence) | steam_germany: (required_age=18, descriptors=Drastische Gewalt Sexuelle Inhalte Drogen)"
