steam_appid,type,name,required_age,is_free,header_imagedlc,developers,publishers,detailed_description,about_the_game,short_description,supported_languages,package_prices,categories,genres,movies,achievements_total,achievements_highlight,coming_soon_date,release_date,num_screenshots,final_price,windows,mac,linux,total_rec_counts,pc_req_min,mac_req_min,linux_req_min,pc_req_rec,mac_req_rec,linux_req_rec,regions_description
730,game,Counter-Strike 2,0,True,,['Valve'],['Valve'],"For over two decades, Counter - Strike has offered an elite competitive experience, one shaped by millions of players from across the globe. And now the next chapter in the CS story is about to begin. This is Counter - Strike 2.; A free upgrade to CS: GO, Counter - Strike 2 marks the largest technical leap in Counter - Strike’s history. Built on the Source 2 engine, Counter - Strike 2 is modernized with realistic physically - based rendering, state of the art networking, and upgraded Community Workshop tools.; In addition to the classic objective - focused gameplay that Counter - Strike pioneered in 1999, Counter - Strike 2 features:; ; All - new CS Ratings with the updated Premier mode; Global and Regional leaderboards; Upgraded and overhauled maps; Game - changing dynamic smoke grenades; Tick - rate - independent gameplay; Redesigned visual effects and audio; All items from CS: GO moving forward to CS2","For over two decades, Counter - Strike has offered an elite competitive experience, one shaped by millions of players from across the globe. And now the next chapter in the CS story is about to begin. This is Counter - Strike 2.; A free upgrade to CS: GO, Counter - Strike 2 marks the largest technical leap in Counter - Strike’s history. Built on the Source 2 engine, Counter - Strike 2 is modernized with realistic physically - based rendering, state of the art networking, and upgraded Community Workshop tools.; In addition to the classic objective - focused gameplay that Counter - Strike pioneered in 1999, Counter - Strike 2 features:; ; All - new CS Ratings with the updated Premier mode; Global and Regional leaderboards; Upgraded and overhauled maps; Game - changing dynamic smoke grenades; Tick - rate - independent gameplay; Redesigned visual effects and audio; All items from CS: GO moving forward to CS2","For over two decades, Counter - Strike has offered an elite competitive experience, one shaped by millions of players from across the globe. And now the next chapter in the CS story is about to begin. This is Counter - Strike 2.","Czech, Danish, Dutch, English , Finnish, French, German, Hungarian, Italian, Japanese, Korean, Norwegian, Polish, Portuguese - Portugal, Portuguese - Brazil, Romanian, Russian, Simplified Chinese, Spanish - Spain, Swedish, Thai, Traditional Chinese, Turkish, Bulgarian, Ukrainian, Greek, Spanish - Latin America, Vietnamese, Indonesian; languages with full audio support","[0, 10300]","['Multi-player', 'Cross-Platform Multiplayer', 'Steam Trading Cards', 'Steam Workshop', 'In-App Purchases', 'Adjustable Text Size', 'Camera Comfort', 'Color Alternatives', 'Custom Volume Controls', 'Playable without Timed Input', 'Stereo Sound', 'Surround Sound', 'Valve Anti-Cheat enabled', 'Stats', 'Remote Play on Phone', 'Remote Play on Tablet', 'Remote Play on TV', 'Steam Timeline']","['Action', 'Free To Play']","['Launch Trailer', 'Moving Beyond Tick Rate', 'Leveling Up', 'Responsive Smokes']",1,['A New Beginning'],False,2017-09-15,19,,True,False,True,4720728,Minimum:; OS: Windows 10; Processor: 4 hardware CPU threads - Intel Core i5 750 or higher; Memory: 8 GB RAM; Graphics: Video card must be 1 GB or more and should be a DirectX 11 - compatible with support for Shader Model 5. 0; DirectX: Version 11; Storage: 85 GB available space,Minimum:; OS: MacOS X 10. 11 (El Capitan) or later; Processor: Intel Core Duo Processor (2GHz or better); Memory: 2 GB RAM; Graphics: ATI Radeon HD 2400 or better / NVIDIA 8600M or better; Storage: 15 GB available space,Minimum:; OS: Ubuntu 20. 04; Processor: 4 hardware CPU threads - Intel Core i5 750 or higher; Memory: 8 GB RAM; Graphics: AMD GCN+ or NVIDIA Kepler+ with up - to - date Vulkan drivers. Support for VK_EXT_graphics_pipeline_library highly recommended.; Storage: 85 GB available space; Sound Card: Highly recommended,,,,"usk: (required_age=16, descriptors=Gewalt; In - Game Käufe (+zufällige Objekte); Chats) | agcom: (required_age=16, descriptors=Violenza) | cadpa: (required_age=12, descriptors=) | dejus: (required_age=16, descriptors=Violência) | steam_germany: (required_age=16, descriptors=Drastische Gewalt)"
570,game,Dota 2,0,True,,['Valve'],['Valve'],"The most - played game on Steam.; Every day, millions of players worldwide enter battle as one of over a hundred Dota heroes. And no matter if it's their 10th hour of play or 1, 000th, there's always something new to discover. With regular updates that ensure a constant evolution of gameplay, features, and heroes, Dota 2 has truly taken on a life of its own.; One Battlefield. Infinite Possibilities.; When it comes to diversity of heroes, abilities, and powerful items, Dota boasts an endless array - no two games are the same. Any hero can fill multiple roles, and there's an abundance of items to help meet the needs of each game. Dota doesn't provide limitations on how to play, it empowers you to express your own style.; All heroes are free.; Competitive balance is Dota's crown jewel, and to ensure everyone is playing on an even field, the core content of the game - like the vast pool of heroes - is available to all players. Fans can collect cosmetics for heroes and fun add - ons for the world they inhabit, but everything you need to play is already included before you join your first match.; Bring your friends and party up.; Dota is deep, and constantly evolving, but it's never too late to join.; Learn the ropes playing co - op vs. bots. Sharpen your skills in the hero demo mode. Jump into the behavior - and skill - based matchmaking system that ensures you'll; be matched with the right players each game.","The most - played game on Steam.; Every day, millions of players worldwide enter battle as one of over a hundred Dota heroes. And no matter if it's their 10th hour of play or 1, 000th, there's always something new to discover. With regular updates that ensure a constant evolution of gameplay, features, and heroes, Dota 2 has truly taken on a life of its own.; One Battlefield. Infinite Possibilities.; When it comes to diversity of heroes, abilities, and powerful items, Dota boasts an endless array - no two games are the same. Any hero can fill multiple roles, and there's an abundance of items to help meet the needs of each game. Dota doesn't provide limitations on how to play, it empowers you to express your own style.; All heroes are free.; Competitive balance is Dota's crown jewel, and to ensure everyone is playing on an even field, the core content of the game - like the vast pool of heroes - is available to all players. Fans can collect cosmetics for heroes and fun add - ons for the world they inhabit, but everything you need to play is already included before you join your first match.; Bring your friends and party up.; Dota is deep, and constantly evolving, but it's never too late to join.; Learn the ropes playing co - op vs. bots. Sharpen your skills in the hero demo mode. Jump into the behavior - and skill - based matchmaking system that ensures you'll; be matched with the right players each game.","Every day, millions of players worldwide enter battle as one of over a hundred Dota heroes. And no matter if it's their 10th hour of play or 1, 000th, there's always something new to discover. With regular updates that ensure a constant evolution of gameplay, features, and heroes, Dota 2 has taken on a life of its own.","Bulgarian, Czech, Danish, Dutch, English , Finnish, French, German, Greek, Hungarian, Italian, Japanese, Korean , Norwegian, Polish, Portuguese - Portugal, Portuguese - Brazil, Romanian, Russian, Simplified Chinese , Spanish - Spain, Swedish, Thai, Traditional Chinese, Turkish, Ukrainian, Spanish - Latin America, Vietnamese; languages with full audio support",[0],"['Multi-player', 'Co-op', 'Steam Trading Cards', 'Steam Workshop', 'SteamVR Collectibles', 'In-App Purchases', 'Camera Comfort', 'Color Alternatives', 'Custom Volume Controls', 'Valve Anti-Cheat enabled', 'Steam Timeline']","['Action', 'Strategy', 'Free To Play']","['Dota 2 - Join the Battle', 'Dota 2 - Sizzle Reel', 'Dota 2 - The Greeviling', 'Dota 2 Gamescom Trailer', 'Dota 2 Reborn - Custom Games Are Here']",0,[],False,2013-07-09,10,,True,True,True,14362,"Minimum:; OS : Windows 7 or newer; Processor: Dual core from Intel or AMD at 2. 8 GHz; Memory: 4 GB RAM; Graphics: NVIDIA GeForce 8600/9600GT, ATI/AMD Radeon HD2600/3600; DirectX: Version 11; Network: Broadband Internet connection; Storage: 60 GB available space; Sound Card: DirectX Compatible","Minimum:; OS: macOS 10. 15 or newer; Processor: Dual core from Intel; Memory: 4 GB RAM; Graphics: Metal - capable GPU (AMD GCN - based GPU or newer, NVIDIA Kepler - based GPU or newer, Intel HD 4000 or newer); Network: Broadband Internet connection; Storage: 60 GB available space","Minimum:; OS: Ubuntu 12. 04 or newer; Processor: Dual core from Intel or AMD at 2. 8 GHz; Memory: 4 GB RAM; Graphics: AMD GCN+, NVIDIA Kepler+, or Intel HD 5000 - series or newer; Network: Broadband Internet connection; Storage: 60 GB available space; Sound Card: OpenAL Compatible Sound Card",,,,"kgrb: (required_age=12, descriptors=12 (12세 이상 이용가) 만 12세 미만의 자는 이용할 수 없는 게임물) | usk: (required_age=12, descriptors=) | agcom: (required_age=12, descriptors=Violenza) | cadpa: (required_age=12, descriptors=) | dejus: (required_age=12, descriptors=Drogas lícitas Medo) | steam_germany: (required_age=12, descriptors=Alkohol / Tabak Gewalt)"
578080,game,PUBG: BATTLEGROUNDS,0,True,,['PUBG Corporation'],"['KRAFTON, Inc.']","LAND Drop into an ever - growing and changing selection of maps to keep you challenged. Will you choose the safer outskirts and risk not getting enough loot or hot drop into the dense cities and fight from the moment you hit the ground? Every drop is different, it's up to you to make the best with what you find. LOOT With unique weapons, a variety of supplies, and special tools to outwit your opponents, how you outfit yourself is up to you! Kit out your favorite weapons with powerful attachments or risk going after the hotly contested Care Packages for unique loot to give you the edge you need to win. SURVIVE Stocking up is only the beginning. With the Safe Zone growing ever smaller as time goes on, your risk of running into other survivors dramatically increases. Die and you're out. You'll need to outthink, outrun, or outshoot your opponents if you're to be the last one standing and claim ultimate victory. MANY WAYS TO PLAY, Warm up in Team Deathmatch, try out constantly changing modes in the Arcade, drop into the latest seasonal event, or build your own custom lobby and challenge your friends to something unique. EVERY MATCH IS UNIQUE No two battles are the same, and everything hinges on the choices you make to land, loot and survive. Drop into the Battlegrounds where victory hinges on every move and every choice, and fight to be the last one standing. Optional in - game purchases available.","LAND Drop into an ever - growing and changing selection of maps to keep you challenged. Will you choose the safer outskirts and risk not getting enough loot or hot drop into the dense cities and fight from the moment you hit the ground? Every drop is different, it's up to you to make the best with what you find. LOOT With unique weapons, a variety of supplies, and special tools to outwit your opponents, how you outfit yourself is up to you! Kit out your favorite weapons with powerful attachments or risk going after the hotly contested Care Packages for unique loot to give you the edge you need to win. SURVIVE Stocking up is only the beginning. With the Safe Zone growing ever smaller as time goes on, your risk of running into other survivors dramatically increases. Die and you're out. You'll need to outthink, outrun, or outshoot your opponents if you're to be the last one standing and claim ultimate victory. MANY WAYS TO PLAY, Warm up in Team Deathmatch, try out constantly changing modes in the Arcade, drop into the latest seasonal event, or build your own custom lobby and challenge your friends to something unique. EVERY MATCH IS UNIQUE No two battles are the same, and everything hinges on the choices you make to land, loot and survive. Drop into the Battlegrounds where victory hinges on every move and every choice, and fight to be the last one standing. Optional in - game purchases available.","PUBG: BATTLEGROUNDS, the high - stakes winner - take - all shooter that started the Battle Royale craze, is free - to - play! Drop into diverse maps, loot unique weapons and supplies, and survive in an ever - shrinking zone where every turn could be your last.","English, Korean, Simplified Chinese, French, German, Spanish - Spain, Arabic, Japanese, Polish, Portuguese - Portugal, Russian, Turkish, Thai, Italian, Portuguese - Brazil, Traditional Chinese, Ukrainian",[],"['Multi-player', 'PvP', 'Online PvP', 'Stats', 'Remote Play on Phone', 'Remote Play on Tablet']","['Action', 'Adventure', 'Massively Multiplayer', 'Free To Play']","['8th Anniversary', 'Lucky Day', 'F2P Launch_Gameplay Trailer', 'F2P Launch_Live Action Trailer']",37,"['Last Survivor', 'Winner Winner Chicken Dinner!', 'Dynamic Duo', 'Fantastic Four', 'Top 10', 'Pacifist', 'CQB Master', 'CQB Expert', 'CQB Novice', 'Marksman Master']",False,2017-12-21,20,,True,False,False,1749679,Minimum:; Requires a 64 - bit processor and operating system; OS: 64 - bit Windows 10; Processor: Intel Core i5 - 4430 / AMD FX - 6300; Memory: 8 GB RAM; Graphics: NVIDIA GeForce GTX 960 2GB / AMD Radeon R7 370 2GB; DirectX: Version 11; Network: Broadband Internet connection; Storage: 40 GB available space,Minimum:,Minimum:,Recommended:; Requires a 64 - bit processor and operating system; OS: 64 - bit Windows 10; Processor: Intel Core i5 - 6600K / AMD Ryzen 5 1600; Memory: 16 GB RAM; Graphics: NVIDIA GeForce GTX 1060 3GB / AMD Radeon RX 580 4GB; DirectX: Version 11; Network: Broadband Internet connection; Storage: 50 GB available space,Recommended:,Recommended:,"kgrb: (required_age=18, descriptors=폭력성) | esrb: (required_age=13, descriptors=Violence Blood Users Interact) | usk: (required_age=16, descriptors=Games in this category may contain more intense violence, including depictions of combat with realistic weapons or fighting. The game might have more serious, darker themes (e. g. , crime, horror, or war) and could include some blood, crude humor, or stronger language. These elements should not be overly graphic, but the violence and tension are at a level inappropriate for younger players.) | dejus: (required_age=0, descriptors=) | steam_germany: (required_age=0, descriptors=)"
2807960,game,Battlefield™ 6,0,False,,['Battlefield Studios'],['Electronic Arts'],"Battlefield 6 Phantom Edition; ; Get the Battlefield 6 Phantom Edition and receive:; Battlefield Pro Token; The Phantom Pack, featuring:; ‎; Phantom Squad: 4 Soldier Skins; ‎ 2 Weapon Packages; ‎ Melee Knife Weapon Skin; Vehicle Skin; Weapon Sticker; ‎Weapon Charm; ‎Dog Tag; Phantom XP Boost Set; About the Game The ultimate all - out warfare experience. Fight in high - intensity infantry combat. Rip through the skies in aerial dogfights. Demolish your environment for a strategic advantage. Harness complete control over every action and movement using the Kinesthetic Combat System. In a war of tanks, fighter jets, and massive combat arsenals, the deadliest weapon is your squad. This is Battlefield 6.; ; ; This game includes optional in - game purchases of virtual currency that can be used to acquire virtual in - game items.","The ultimate all - out warfare experience. Fight in high - intensity infantry combat. Rip through the skies in aerial dogfights. Demolish your environment for a strategic advantage. Harness complete control over every action and movement using the Kinesthetic Combat System. In a war of tanks, fighter jets, and massive combat arsenals, the deadliest weapon is your squad. This is Battlefield 6.; ; ; This game includes optional in - game purchases of virtual currency that can be used to acquire virtual in - game items.","The ultimate all - out warfare experience. In a war of tanks, fighter jets, and massive combat arsenals, your squad is the deadliest weapon.","English , French , Italian , German , Spanish - Spain , Arabic, Japanese , Korean , Polish , Portuguese - Brazil , Simplified Chinese , Spanish - Latin America , Traditional Chinese; languages with full audio support","[129900000, 179900000]","['Single-player', 'Multi-player', 'PvP', 'Online PvP', 'Cross-Platform Multiplayer', 'Steam Achievements', 'Full controller support', 'In-App Purchases', 'Camera Comfort', 'Chat Speech-to-text', 'Chat Text-to-speech', 'Color Alternatives', 'Custom Volume Controls', 'Adjustable Difficulty', 'Keyboard Only Option', 'Playable without Timed Input', 'Stereo Sound', 'Subtitle Options', 'Surround Sound', 'Steam Cloud', 'HDR available']",['Action'],"['Battlefield 6: Official Launch Hype Trailer', 'Gameplay MP Trailer', 'Battlefield 6 Official Reveal Trailer']",54,"['Stand Alone', 'Rock of Gibraltar', 'Devil in the Dark', 'Secret Service', 'High Roller', 'Damned If You Do', 'Cloak and Dagger', 'In Memoriam', 'Dogs of War', 'Hounds of War']",False,2025-10-10,10,,True,False,False,93441,"Minimum:; Requires a 64 - bit processor and operating system; OS: Windows 10; Processor: Intel Core i5 - 8400, AMD Ryzen 5 2600; Memory: 16 GB RAM; Graphics: Nvidia RTX 2060, AMD Radeon RX 5600 XT 6GB, Intel Arc A380; DirectX: Version 12; Network: Broadband Internet connection; Storage: 55 GB available space; Sound Card: No Recommendation; VR Support: Not Supported; Additional Notes: TPM 2. 0 Enabled UEFI SECURE BOOT Enabled HVCI Capable VBS Capable",Minimum:,Minimum:,"Recommended:; Requires a 64 - bit processor and operating system; OS: Windows 11; Processor: Intel Core i7 - 10700, AMD Ryzen 7 3700X; Memory: 16 GB RAM; Graphics: Nvidia RTX 3060Ti, AMD Radeon RX 6700 - XT, Intel Arc B580; DirectX: Version 12; Network: Broadband Internet connection; Storage: 80 GB available space; Sound Card: No Recommendation; VR Support: Not Supported; Additional Notes: TPM 2. 0 Enabled UEFI SECURE BOOT Enabled HVCI Capable VBS Capable",Recommended:,Recommended:,"esrb: (required_age=15, descriptors=Blood and Gore Intense Violence Strong Language) | pegi: (required_age=16, descriptors=Bad Language Violence) | usk: (required_age=18, descriptors=Drastische Gewalt Kriegsthematik) | oflc: (required_age=15, descriptors=Strong battle violence in - game purchases and online interactivity and chat) | nzoflc: (required_age=16, descriptors=Violence & Offensive Language) | cero: (required_age=17, descriptors=Violence) | kgrb: (required_age=0, descriptors=Language Violence) | gmedia: (required_age=18, descriptors=) | dejus: (required_age=16, descriptors=Violência Extrema (Extreme Violence)) | mda: (required_age=18, descriptors=Violence and Coarse Language) | fpb: (required_age=18, descriptors=CI (Competitive Intensity) L (Language) PPS (Photo or pattern sensitivity, motion sickness and reactions to low frequency sound) V (Violence)) | csrr: (required_age=0, descriptors=不當言語 (Inappropriate Language) 暴力 (Violence)) | steam_germany: (required_age=12, descriptors=)"
